{
  "$schema": "https://json-schema.org/draft/2020-12/schema",
  "title": "stats/runs/YYYY-MM/YYYY-MM-DD-HHMM-<agent>.json",
  "description": "Report běhu agenta podle docs/monitoring.md.",
  "type": "object",
  "required": ["schema_version", "agent", "run_id", "started_at", "status"],
  "additionalProperties": false,
  "properties": {
    "schema_version": {"const": 1},
    "agent": {"enum": ["planner", "discovery", "curator", "quality", "facebook", "pipeline"]},
    "run_id": {"type": "string", "pattern": "^\\d{4}-\\d{2}-\\d{2}-\\d{4,12}-[a-z]+$"},
    "started_at": {"$ref": "#/$defs/timestamp"},
    "finished_at": {"anyOf": [{"$ref": "#/$defs/timestamp"}, {"type": "null"}]},
    "duration_seconds": {"type": ["number", "null"], "minimum": 0},
    "status": {"enum": ["success", "partial", "failed", "no-change"]},
    "partial_reason": {"type": ["string", "null"]},
    "commit_sha": {"type": ["string", "null"]},
    "metrics": {"type": "object"},
    "coverage": {
      "type": "object",
      "additionalProperties": false,
      "properties": {
        "regions": {"type": "array", "items": {"type": "string"}},
        "districts": {"type": "array", "items": {"type": "string"}},
        "municipalities": {"type": "array", "items": {"type": "string"}},
        "sources": {"type": "array", "items": {"type": "string"}}
      }
    },
    "errors": {"type": "array"},
    "notes": {"type": "array"},
    "suggested_event_ids": {"type": "array", "items": {"type": "string"}}
  },
  "$defs": {
    "timestamp": {
      "type": "string",
      "pattern": "^\\d{4}-\\d{2}-\\d{2}T\\d{2}:\\d{2}:\\d{2}(\\.\\d+)?([+-]\\d{2}:\\d{2}|Z)$"
    }
  }
}
