{
  "schema_version": 1,
  "agent": "facebook",
  "run_id": "2026-08-02-1820-facebook",
  "started_at": "2026-08-02T18:20:50+02:00",
  "finished_at": "2026-08-02T18:42:22+02:00",
  "duration_seconds": 1292,
  "status": "partial",
  "partial_reason": "část stránek se nepodařilo načíst",
  "commit_sha": "59df5816086b983bfedb11447a5f05bca31bf78e",
  "metrics": {
    "facebook_pages_checked": 36,
    "facebook_events_extracted": 85,
    "facebook_details_fetched": 82,
    "facebook_blocked": 1,
    "facebook_duplicates": 3,
    "facebook_suggested_events_seen": 107,
    "facebook_blocks_unparsed": 0
  },
  "coverage": {
    "regions": [
      "kralovehradecky-kraj",
      "pardubicky-kraj"
    ],
    "districts": [
      "Chrudim",
      "Hradec Králové",
      "Jičín",
      "Náchod",
      "Pardubice",
      "Rychnov nad Kněžnou",
      "Svitavy",
      "Trutnov",
      "Ústí nad Orlicí"
    ],
    "municipalities": [
      "Chrudim",
      "Dvůr Králové nad Labem",
      "Hlinsko",
      "Hradec Králové",
      "Janderov",
      "Jičín",
      "Litomyšl",
      "Náchod",
      "Pardubice",
      "Rychnov nad Kněžnou",
      "Slatiňany",
      "Trutnov",
      "Vysoké Mýto",
      "Vysočina",
      "Ústí nad Orlicí"
    ]
  },
  "errors": [
    {
      "source": "hlinsko.cz",
      "error": "nenalezeny žádné bloky událostí"
    }
  ],
  "notes": [
    "Blok „Navrhované události“ nabídl 107 dalších ID akcí mimo seed list. Úplný seznam je v poli suggested_event_ids."
  ],
  "suggested_event_ids": [
    "1003484108930443",
    "1008000038645928",
    "1011263541399800",
    "1015275364367676",
    "1019785457305134",
    "1021168777248030",
    "1022735970250450",
    "1026247337026628",
    "1027080579728134",
    "1042696645368133",
    "1057006220085282",
    "1057182850111630",
    "1059001586506997",
    "1067874045908906",
    "1154362003446791",
    "1176129038915899",
    "1194444690410890",
    "1268091452182298",
    "1269517655059026",
    "1287966610075408",
    "1308834944161090",
    "1314227213612671",
    "1316836287284765",
    "1322691390031243",
    "1337479564974618",
    "1348582617248553",
    "1354402893564007",
    "1376653121044041",
    "1431128985369234",
    "1445748153673976",
    "1454859730001951",
    "1472849344591153",
    "1476451227614606",
    "1479812513473879",
    "1480695027119211",
    "1492302958743664",
    "1511523643474790",
    "1538661274332686",
    "1548794813368344",
    "1552022649770483",
    "1553648102954873",
    "1558847755572756",
    "1560786388884804",
    "1561504702252430",
    "1565336371812897",
    "1565750484703511",
    "1568117168385591",
    "1570092504479060",
    "1582196406769486",
    "1584759156557240",
    "1584902319689583",
    "1619190223188164",
    "1627412075008951",
    "1647634136221989",
    "1656542025642716",
    "1672140360516452",
    "1716305079390896",
    "1729082198146532",
    "1752951262543883",
    "1763634001660999",
    "1837178060287767",
    "1863818297624183",
    "1893280658021019",
    "1967664087439219",
    "2028959224651262",
    "2048899019177243",
    "2087558965308068",
    "2088162818745102",
    "2094692364791197",
    "2111852839582498",
    "2127934741274139",
    "2130737584350657",
    "2178057739675150",
    "2182100699020232",
    "2183861588805060",
    "2196287994493104",
    "2230990481007573",
    "2458359214590386",
    "2506378699870783",
    "2513982635665872",
    "26742793605376688",
    "2702410716761666",
    "27933835232890087",
    "28018480151079845",
    "2830104287331526",
    "3122175334840065",
    "3627443264074244",
    "4172342696362054",
    "4327864257432188",
    "4355653098038045",
    "4416204405324421",
    "4485074701778341",
    "4637362023166744",
    "668990106208793",
    "781050978290415",
    "822415787055602",
    "830593353321892",
    "848057961489638",
    "886572631163722",
    "898079976503717",
    "928758309874726",
    "933445269514900",
    "934175439707181",
    "953233340830958",
    "957288323790470",
    "969241209468682",
    "998317026446747"
  ]
}
