{
  "schema_version": 1,
  "agent": "curator",
  "run_id": "2026-08-02-0830-curator",
  "started_at": "2026-08-02T08:24:00+02:00",
  "finished_at": "2026-08-02T08:30:00+02:00",
  "duration_seconds": null,
  "status": "partial",
  "partial_reason": "Zpracován známý nový discovery soubor; GitHub code search nevrátil další kandidátní soubory a úplná hromadná validace všech odkazů nebyla v tomto běhu provedena.",
  "commit_sha": "5b3f4cd4d633fb67b0eabad1bfcc318ee5206183",
  "metrics": {
    "candidates_reviewed": 6,
    "events_added": 6,
    "events_updated": 0,
    "events_cancelled": 0,
    "candidates_rejected": 0,
    "duplicates_removed": 0,
    "deferred_candidates": 0,
    "backlog_after": 0
  },
  "coverage": {
    "regions": ["pardubicky-kraj"],
    "districts": ["Chrudim", "Svitavy"],
    "municipalities": ["Hlinsko", "Litomyšl"]
  },
  "errors": [],
  "notes": [
    "Čtyři kandidáti pro 2026-08-02 byly zapsány do 2026-W31.",
    "Letní kino Hlinsko 2026-08-04 a Vzpomínková jízda na Elišku a Čeňka Junkovy byly zapsány do 2026-W32.",
    "U vzpomínkové jízdy byl proti kandidátnímu textu ověřen rozsah 2026-08-07 až 2026-08-09; stabilní kandidátní ID bylo zachováno.",
    "data/manifest.json a data/weeks/2026-W33.json byly zkontrolovány bez nutnosti změny."
  ]
}
