{
  "schema_version": 1,
  "agent": "facebook",
  "run_id": "2026-08-02-2043-facebook",
  "started_at": "2026-08-02T20:43:19+02:00",
  "finished_at": "2026-08-02T21:05:21+02:00",
  "duration_seconds": 1322,
  "status": "success",
  "partial_reason": null,
  "commit_sha": "b4b2a1d8b88305d97ae1a479327bf2f2c01e08f5",
  "metrics": {
    "facebook_pages_checked": 35,
    "facebook_events_extracted": 85,
    "facebook_details_fetched": 82,
    "facebook_blocked": 0,
    "facebook_duplicates": 3,
    "facebook_suggested_events_seen": 75,
    "facebook_blocks_unparsed": 0,
    "facebook_details_failed": 0
  },
  "coverage": {
    "regions": [
      "kralovehradecky-kraj",
      "pardubicky-kraj"
    ],
    "districts": [
      "Chrudim",
      "Hradec Králové",
      "Jičín",
      "Náchod",
      "Pardubice",
      "Rychnov nad Kněžnou",
      "Svitavy",
      "Trutnov",
      "Ústí nad Orlicí"
    ],
    "municipalities": [
      "Chrudim",
      "Dvůr Králové nad Labem",
      "Hlinsko",
      "Hradec Králové",
      "Janderov",
      "Jičín",
      "Litomyšl",
      "Náchod",
      "Pardubice",
      "Rychnov nad Kněžnou",
      "Slatiňany",
      "Trutnov",
      "Vysoké Mýto",
      "Vysočina",
      "Ústí nad Orlicí"
    ]
  },
  "errors": [],
  "notes": [
    "Blok „Navrhované události“ nabídl 75 dalších ID akcí mimo seed list. Úplný seznam je v poli suggested_event_ids."
  ],
  "suggested_event_ids": [
    "1004959509208620",
    "1008000038645928",
    "1011263541399800",
    "1015275364367676",
    "1021168777248030",
    "1026247337026628",
    "1027080579728134",
    "1042696645368133",
    "1057006220085282",
    "1059001586506997",
    "1067874045908906",
    "1154362003446791",
    "1194444690410890",
    "1268091452182298",
    "1269517655059026",
    "1308834944161090",
    "1314227213612671",
    "1316836287284765",
    "1322691390031243",
    "1337479564974618",
    "1348582617248553",
    "1354402893564007",
    "1376653121044041",
    "1454859730001951",
    "1472849344591153",
    "1476451227614606",
    "1479812513473879",
    "1480695027119211",
    "1492302958743664",
    "1511523643474790",
    "1538661274332686",
    "1558847755572756",
    "1561504702252430",
    "1565336371812897",
    "1565750484703511",
    "1570092504479060",
    "1582196406769486",
    "1584759156557240",
    "1584902319689583",
    "1619190223188164",
    "1627412075008951",
    "1647634136221989",
    "1656542025642716",
    "1672140360516452",
    "1716305079390896",
    "1729082198146532",
    "1752951262543883",
    "1763634001660999",
    "1825270748838981",
    "1837178060287767",
    "1967664087439219",
    "2111852839582498",
    "2130737584350657",
    "2178057739675150",
    "2183861588805060",
    "2230990481007573",
    "2506378699870783",
    "2702410716761666",
    "2830104287331526",
    "3122175334840065",
    "3627443264074244",
    "4172342696362054",
    "4327864257432188",
    "4355653098038045",
    "4416204405324421",
    "781050978290415",
    "822415787055602",
    "830593353321892",
    "848057961489638",
    "886572631163722",
    "933445269514900",
    "934175439707181",
    "953233340830958",
    "957288323790470",
    "976438791663944"
  ]
}
